"Status","Start Time","Stop Time","Duration in ms","Parent Suite","Suite","Sub Suite","Test Class","Test Method","Name","Description"
"passed","Mon Aug 14 02:20:39 GMT 2023","Mon Aug 14 02:20:40 GMT 2023","691","","Add Remove Elements","","","","validate, delete button is not visible & not exist",""
"passed","Mon Aug 14 02:20:37 GMT 2023","Mon Aug 14 02:20:38 GMT 2023","1047","","Add Remove Elements","","","","validate, add element button is visible",""
"passed","Mon Aug 14 02:20:35 GMT 2023","Mon Aug 14 02:20:35 GMT 2023","412","","A/B Testing","","","","validate, hearder text and ab testing header text",""
"passed","Mon Aug 14 02:20:44 GMT 2023","Mon Aug 14 02:20:45 GMT 2023","1365","","Form Authentication","","","","validate, login successful text",""
"passed","Mon Aug 14 02:20:38 GMT 2023","Mon Aug 14 02:20:39 GMT 2023","577","","Add Remove Elements","","","","validate, delete button is visible & exist",""
