"Status","Start Time","Stop Time","Duration in ms","Parent Suite","Suite","Sub Suite","Test Class","Test Method","Name","Description"
"passed","Sun Apr 16 02:36:30 GMT 2023","Sun Apr 16 02:36:30 GMT 2023","312","","A/B Testing","","","","validate, hearder text and ab testing header text",""
"passed","Sun Apr 16 02:36:32 GMT 2023","Sun Apr 16 02:36:32 GMT 2023","490","","Add Remove Elements","","","","validate, add element button is visible",""
"passed","Sun Apr 16 02:36:36 GMT 2023","Sun Apr 16 02:36:37 GMT 2023","940","","Form Authentication","","","","validate, login successful text",""
"passed","Sun Apr 16 02:36:33 GMT 2023","Sun Apr 16 02:36:33 GMT 2023","409","","Add Remove Elements","","","","validate, delete button is not visible & not exist",""
"passed","Sun Apr 16 02:36:32 GMT 2023","Sun Apr 16 02:36:33 GMT 2023","355","","Add Remove Elements","","","","validate, delete button is visible & exist",""
