"Status","Start Time","Stop Time","Duration in ms","Parent Suite","Suite","Sub Suite","Test Class","Test Method","Name","Description"
"passed","Thu Nov 30 02:29:13 GMT 2023","Thu Nov 30 02:29:13 GMT 2023","237","","A/B Testing","","","","validate, hearder text and ab testing header text",""
"passed","Thu Nov 30 02:29:17 GMT 2023","Thu Nov 30 02:29:18 GMT 2023","852","","Form Authentication","","","","validate, login successful text",""
"passed","Thu Nov 30 02:29:15 GMT 2023","Thu Nov 30 02:29:15 GMT 2023","298","","Add Remove Elements","","","","validate, delete button is visible & exist",""
"passed","Thu Nov 30 02:29:14 GMT 2023","Thu Nov 30 02:29:15 GMT 2023","391","","Add Remove Elements","","","","validate, add element button is visible",""
"passed","Thu Nov 30 02:29:15 GMT 2023","Thu Nov 30 02:29:15 GMT 2023","361","","Add Remove Elements","","","","validate, delete button is not visible & not exist",""
