"Status","Start Time","Stop Time","Duration in ms","Parent Suite","Suite","Sub Suite","Test Class","Test Method","Name","Description"
"passed","Fri May 12 02:31:53 GMT 2023","Fri May 12 02:31:53 GMT 2023","361","","Add Remove Elements","","","","validate, delete button is visible & exist",""
"passed","Fri May 12 02:31:50 GMT 2023","Fri May 12 02:31:51 GMT 2023","295","","A/B Testing","","","","validate, hearder text and ab testing header text",""
"passed","Fri May 12 02:31:52 GMT 2023","Fri May 12 02:31:53 GMT 2023","492","","Add Remove Elements","","","","validate, add element button is visible",""
"passed","Fri May 12 02:31:53 GMT 2023","Fri May 12 02:31:54 GMT 2023","405","","Add Remove Elements","","","","validate, delete button is not visible & not exist",""
"passed","Fri May 12 02:31:56 GMT 2023","Fri May 12 02:31:57 GMT 2023","921","","Form Authentication","","","","validate, login successful text",""
