"Status","Start Time","Stop Time","Duration in ms","Parent Suite","Suite","Sub Suite","Test Class","Test Method","Name","Description"
"passed","Mon Jun 19 02:43:55 GMT 2023","Mon Jun 19 02:43:55 GMT 2023","337","","A/B Testing","","","","validate, hearder text and ab testing header text",""
"passed","Mon Jun 19 02:43:59 GMT 2023","Mon Jun 19 02:43:59 GMT 2023","568","","Add Remove Elements","","","","validate, delete button is not visible & not exist",""
"passed","Mon Jun 19 02:43:57 GMT 2023","Mon Jun 19 02:43:58 GMT 2023","917","","Add Remove Elements","","","","validate, add element button is visible",""
"passed","Mon Jun 19 02:44:02 GMT 2023","Mon Jun 19 02:44:03 GMT 2023","1046","","Form Authentication","","","","validate, login successful text",""
"passed","Mon Jun 19 02:43:58 GMT 2023","Mon Jun 19 02:43:59 GMT 2023","512","","Add Remove Elements","","","","validate, delete button is visible & exist",""
