"Status","Start Time","Stop Time","Duration in ms","Parent Suite","Suite","Sub Suite","Test Class","Test Method","Name","Description"
"passed","Wed Sep 27 02:22:23 GMT 2023","Wed Sep 27 02:22:24 GMT 2023","634","","Add Remove Elements","","","","validate, delete button is not visible & not exist",""
"passed","Wed Sep 27 02:22:22 GMT 2023","Wed Sep 27 02:22:23 GMT 2023","868","","Add Remove Elements","","","","validate, add element button is visible",""
"passed","Wed Sep 27 02:22:27 GMT 2023","Wed Sep 27 02:22:28 GMT 2023","1096","","Form Authentication","","","","validate, login successful text",""
"passed","Wed Sep 27 02:22:23 GMT 2023","Wed Sep 27 02:22:23 GMT 2023","500","","Add Remove Elements","","","","validate, delete button is visible & exist",""
"passed","Wed Sep 27 02:22:20 GMT 2023","Wed Sep 27 02:22:20 GMT 2023","306","","A/B Testing","","","","validate, hearder text and ab testing header text",""
