"Status","Start Time","Stop Time","Duration in ms","Parent Suite","Suite","Sub Suite","Test Class","Test Method","Name","Description"
"passed","Sat Jul 15 03:03:55 GMT 2023","Sat Jul 15 03:03:56 GMT 2023","675","","Add Remove Elements","","","","validate, add element button is visible",""
"passed","Sat Jul 15 03:03:59 GMT 2023","Sat Jul 15 03:04:00 GMT 2023","926","","Form Authentication","","","","validate, login successful text",""
"passed","Sat Jul 15 03:03:52 GMT 2023","Sat Jul 15 03:03:53 GMT 2023","349","","A/B Testing","","","","validate, hearder text and ab testing header text",""
"passed","Sat Jul 15 03:03:56 GMT 2023","Sat Jul 15 03:03:56 GMT 2023","510","","Add Remove Elements","","","","validate, delete button is not visible & not exist",""
"passed","Sat Jul 15 03:03:56 GMT 2023","Sat Jul 15 03:03:56 GMT 2023","415","","Add Remove Elements","","","","validate, delete button is visible & exist",""
