"Status","Start Time","Stop Time","Duration in ms","Parent Suite","Suite","Sub Suite","Test Class","Test Method","Name","Description"
"passed","Mon Apr 10 18:30:16 GMT 2023","Mon Apr 10 18:30:16 GMT 2023","255","","A/B Testing","","","","validate, hearder text and ab testing header text",""
"passed","Mon Apr 10 18:30:18 GMT 2023","Mon Apr 10 18:30:19 GMT 2023","355","","Add Remove Elements","","","","validate, delete button is visible & exist",""
"passed","Mon Apr 10 18:30:19 GMT 2023","Mon Apr 10 18:30:19 GMT 2023","425","","Add Remove Elements","","","","validate, delete button is not visible & not exist",""
"passed","Mon Apr 10 18:30:18 GMT 2023","Mon Apr 10 18:30:18 GMT 2023","504","","Add Remove Elements","","","","validate, add element button is visible",""
"passed","Mon Apr 10 18:30:21 GMT 2023","Mon Apr 10 18:30:22 GMT 2023","919","","Form Authentication","","","","validate, login successful text",""
