"Status","Start Time","Stop Time","Duration in ms","Parent Suite","Suite","Sub Suite","Test Class","Test Method","Name","Description"
"passed","Sat Jul 08 03:00:18 GMT 2023","Sat Jul 08 03:00:19 GMT 2023","479","","Add Remove Elements","","","","validate, delete button is not visible & not exist",""
"passed","Sat Jul 08 03:00:15 GMT 2023","Sat Jul 08 03:00:15 GMT 2023","298","","A/B Testing","","","","validate, hearder text and ab testing header text",""
"passed","Sat Jul 08 03:00:21 GMT 2023","Sat Jul 08 03:00:22 GMT 2023","959","","Form Authentication","","","","validate, login successful text",""
"passed","Sat Jul 08 03:00:18 GMT 2023","Sat Jul 08 03:00:18 GMT 2023","436","","Add Remove Elements","","","","validate, delete button is visible & exist",""
"passed","Sat Jul 08 03:00:17 GMT 2023","Sat Jul 08 03:00:18 GMT 2023","650","","Add Remove Elements","","","","validate, add element button is visible",""
