"Status","Start Time","Stop Time","Duration in ms","Parent Suite","Suite","Sub Suite","Test Class","Test Method","Name","Description"
"passed","Mon Jul 17 03:05:22 GMT 2023","Mon Jul 17 03:05:23 GMT 2023","368","","Add Remove Elements","","","","validate, delete button is visible & exist",""
"passed","Mon Jul 17 03:05:26 GMT 2023","Mon Jul 17 03:05:27 GMT 2023","965","","Form Authentication","","","","validate, login successful text",""
"passed","Mon Jul 17 03:05:22 GMT 2023","Mon Jul 17 03:05:22 GMT 2023","512","","Add Remove Elements","","","","validate, add element button is visible",""
"passed","Mon Jul 17 03:05:20 GMT 2023","Mon Jul 17 03:05:20 GMT 2023","287","","A/B Testing","","","","validate, hearder text and ab testing header text",""
"passed","Mon Jul 17 03:05:23 GMT 2023","Mon Jul 17 03:05:23 GMT 2023","431","","Add Remove Elements","","","","validate, delete button is not visible & not exist",""
