"Status","Start Time","Stop Time","Duration in ms","Parent Suite","Suite","Sub Suite","Test Class","Test Method","Name","Description"
"passed","Fri Dec 01 02:34:51 GMT 2023","Fri Dec 01 02:34:51 GMT 2023","383","","Add Remove Elements","","","","validate, delete button is not visible & not exist",""
"passed","Fri Dec 01 02:34:48 GMT 2023","Fri Dec 01 02:34:49 GMT 2023","222","","A/B Testing","","","","validate, hearder text and ab testing header text",""
"passed","Fri Dec 01 02:34:50 GMT 2023","Fri Dec 01 02:34:51 GMT 2023","295","","Add Remove Elements","","","","validate, delete button is visible & exist",""
"passed","Fri Dec 01 02:34:53 GMT 2023","Fri Dec 01 02:34:54 GMT 2023","861","","Form Authentication","","","","validate, login successful text",""
"passed","Fri Dec 01 02:34:50 GMT 2023","Fri Dec 01 02:34:50 GMT 2023","382","","Add Remove Elements","","","","validate, add element button is visible",""
