"Status","Start Time","Stop Time","Duration in ms","Parent Suite","Suite","Sub Suite","Test Class","Test Method","Name","Description"
"passed","Thu Apr 13 02:32:03 GMT 2023","Thu Apr 13 02:32:03 GMT 2023","495","","Add Remove Elements","","","","validate, add element button is visible",""
"passed","Thu Apr 13 02:32:01 GMT 2023","Thu Apr 13 02:32:01 GMT 2023","294","","A/B Testing","","","","validate, hearder text and ab testing header text",""
"passed","Thu Apr 13 02:32:04 GMT 2023","Thu Apr 13 02:32:04 GMT 2023","410","","Add Remove Elements","","","","validate, delete button is not visible & not exist",""
"passed","Thu Apr 13 02:32:03 GMT 2023","Thu Apr 13 02:32:04 GMT 2023","346","","Add Remove Elements","","","","validate, delete button is visible & exist",""
"passed","Thu Apr 13 02:32:06 GMT 2023","Thu Apr 13 02:32:07 GMT 2023","907","","Form Authentication","","","","validate, login successful text",""
